{
  "schema_version": 1,
  "discovery_path": "docs/discoveries/dcy-0001/disc-0001-r1.md",
  "discovery_id": "disc-0001",
  "revision": 1,
  "sha256": "764189f1a9c0e71c8274f827528a67d1b2dd5dbef81eee94f247d427d3339c37",
  "risk_class": "low",
  "authority": "fixture-maintainer",
  "confirmed_at": "2026-07-20T00:00:00Z",
  "decision": "confirmed",
  "permitted_next_action": "draft_req_only"
}
